<?xml version="1.0" encoding="UTF-8" ?>
<xsd:schema xmlns:xsd="http://www.w3.org/2001/XMLSchema">

	<!-- definition of simple element -->
	<xsd:element name="nomeTag" type="xsd:string" />
    <xsd:element name="modificaEstratto" type="xsd:string" />
	<xsd:element name="emailAdmin" type="xsd:string" />
	<xsd:element name="emailStudente" type="xsd:string" />


	<!-- definition of attributes -->
	<!-- definition of complex elements -->
	<xsd:element name="revisione">
		<xsd:complexType>
			<xsd:sequence>
				<xsd:element ref="nomeTag" />
				<xsd:element ref="emailAdmin" />
                <xsd:element ref="modificaEstratto" />
                <xsd:element ref="emailStudente" />
			</xsd:sequence>
		</xsd:complexType>
	</xsd:element>

	<xsd:element name="revisioni">
		<xsd:complexType>
			<xsd:sequence>
				<xsd:element ref="revisione"  minOccurs="0" maxOccurs="unbounded" />
			</xsd:sequence>
		</xsd:complexType>
	</xsd:element>
</xsd:schema>