<?xml version="1.0" encoding="UTF-8"?>
<revisioni xmlns:xsi="http://www.w3.org/2001/XMLSchema-instance" xsi:noNamespaceSchemaLocation="revisioni.xsd"><revisione><nomeTag>CiAo</nomeTag><emailAdmin>admin1@gmail.com</emailAdmin><modificaEstratto>Questo estratto è riferito al tag ciao che significa blabla e che non avevo voglia di scrivere altro perchè poi mi rompevo le palle.</modificaEstratto><emailStudente>pietro.nardelliz@gmail.com</emailStudente></revisione><revisione><nomeTag>cazzo</nomeTag><emailAdmin>admin1@gmail.com</emailAdmin><modificaEstratto>oiolaiolaila</modificaEstratto><emailStudente>pietro.nardelliz@gmail.com</emailStudente></revisione><revisione><nomeTag>ciao2</nomeTag><emailAdmin>admin2@gmail.com</emailAdmin><modificaEstratto>bl</modificaEstratto><emailStudente>pietro.nardelliz@gmail.com</emailStudente></revisione></revisioni>
